{"schemaVersion":2,"scenarioId":"parquet-behavior","seed":9011,"samples":[{"label":"countdown","tick":0,"snapshot":{"schemaVersion":2,"simulationTick":0,"raceState":"countdown","countdown":{"state":"active","remainingSeconds":3.000000},"elapsedSimulationTime":0.000000,"currentLap":1,"currentProgress":{"checkpoint":0,"completedLaps":0},"participants":[{"id":"ai-0","surface":"asphalt","x":42.000000,"y":17.099998,"rotation":0.000000,"velocityX":0.000000,"velocityY":0.000000,"angularVelocity":0.000000,"longitudinalSpeed":0.000000,"lateralSpeed":0.000000,"driftAmount":0.000000,"checkpoint":0,"lap":0,"racePosition":1,"finished":false},{"id":"ai-1","surface":"asphalt","x":34.500000,"y":15.599999,"rotation":0.000000,"velocityX":0.000000,"velocityY":0.000000,"angularVelocity":0.000000,"longitudinalSpeed":0.000000,"lateralSpeed":0.000000,"driftAmount":0.000000,"checkpoint":0,"lap":0,"racePosition":2,"finished":false},{"id":"ai-2","surface":"asphalt","x":27.000000,"y":17.099998,"rotation":0.000000,"velocityX":0.000000,"velocityY":0.000000,"angularVelocity":0.000000,"longitudinalSpeed":0.000000,"lateralSpeed":0.000000,"driftAmount":0.000000,"checkpoint":0,"lap":0,"racePosition":5,"finished":false},{"id":"ai-3","surface":"asphalt","x":27.000000,"y":20.700001,"rotation":0.000000,"velocityX":0.000000,"velocityY":0.000000,"angularVelocity":0.000000,"longitudinalSpeed":0.000000,"lateralSpeed":0.000000,"driftAmount":0.000000,"checkpoint":0,"lap":0,"racePosition":4,"finished":false},{"id":"ai-4","surface":"asphalt","x":27.000000,"y":22.500000,"rotation":0.000000,"velocityX":0.000000,"velocityY":0.000000,"angularVelocity":0.000000,"longitudinalSpeed":0.000000,"lateralSpeed":0.000000,"driftAmount":0.000000,"checkpoint":0,"lap":0,"racePosition":3,"finished":false},{"id":"player","surface":"parquet","x":12.000000,"y":15.000000,"rotation":0.000000,"velocityX":34.000000,"velocityY":0.000000,"angularVelocity":0.000000,"longitudinalSpeed":34.000000,"lateralSpeed":0.000000,"driftAmount":0.000000,"checkpoint":0,"lap":0,"racePosition":6,"finished":false}],"ranking":["ai-0","ai-1","ai-4","ai-3","ai-2","player"],"finishedParticipants":[],"finishResults":[]}},{"label":"racing","tick":0,"snapshot":{"schemaVersion":2,"simulationTick":0,"raceState":"racing","countdown":{"state":"complete","remainingSeconds":0.000000},"elapsedSimulationTime":0.000000,"currentLap":1,"currentProgress":{"checkpoint":0,"completedLaps":0},"participants":[{"id":"ai-0","surface":"asphalt","x":42.000000,"y":17.099998,"rotation":0.000000,"velocityX":0.000000,"velocityY":0.000000,"angularVelocity":0.000000,"longitudinalSpeed":0.000000,"lateralSpeed":0.000000,"driftAmount":0.000000,"checkpoint":0,"lap":0,"racePosition":1,"finished":false},{"id":"ai-1","surface":"asphalt","x":34.500000,"y":15.599999,"rotation":0.000000,"velocityX":0.000000,"velocityY":0.000000,"angularVelocity":0.000000,"longitudinalSpeed":0.000000,"lateralSpeed":0.000000,"driftAmount":0.000000,"checkpoint":0,"lap":0,"racePosition":2,"finished":false},{"id":"ai-2","surface":"asphalt","x":27.000000,"y":17.099998,"rotation":0.000000,"velocityX":0.000000,"velocityY":0.000000,"angularVelocity":0.000000,"longitudinalSpeed":0.000000,"lateralSpeed":0.000000,"driftAmount":0.000000,"checkpoint":0,"lap":0,"racePosition":5,"finished":false},{"id":"ai-3","surface":"asphalt","x":27.000000,"y":20.700001,"rotation":0.000000,"velocityX":0.000000,"velocityY":0.000000,"angularVelocity":0.000000,"longitudinalSpeed":0.000000,"lateralSpeed":0.000000,"driftAmount":0.000000,"checkpoint":0,"lap":0,"racePosition":4,"finished":false},{"id":"ai-4","surface":"asphalt","x":27.000000,"y":22.500000,"rotation":0.000000,"velocityX":0.000000,"velocityY":0.000000,"angularVelocity":0.000000,"longitudinalSpeed":0.000000,"lateralSpeed":0.000000,"driftAmount":0.000000,"checkpoint":0,"lap":0,"racePosition":3,"finished":false},{"id":"player","surface":"parquet","x":12.000000,"y":15.000000,"rotation":0.000000,"velocityX":34.000000,"velocityY":0.000000,"angularVelocity":0.000000,"longitudinalSpeed":34.000000,"lateralSpeed":0.000000,"driftAmount":0.000000,"checkpoint":0,"lap":0,"racePosition":6,"finished":false}],"ranking":["ai-0","ai-1","ai-4","ai-3","ai-2","player"],"finishedParticipants":[],"finishResults":[]}},{"label":"simulation","tick":1,"snapshot":{"schemaVersion":2,"simulationTick":1,"raceState":"racing","countdown":{"state":"complete","remainingSeconds":0.000000},"elapsedSimulationTime":0.016667,"currentLap":1,"currentProgress":{"checkpoint":0,"completedLaps":0},"participants":[{"id":"ai-0","surface":"asphalt","x":42.006832,"y":17.099998,"rotation":359.999237,"velocityX":0.410000,"velocityY":-0.000001,"angularVelocity":-0.044940,"longitudinalSpeed":0.410000,"lateralSpeed":0.000005,"driftAmount":0.000000,"checkpoint":0,"lap":0,"racePosition":1,"finished":false},{"id":"ai-1","surface":"asphalt","x":34.504665,"y":15.599999,"rotation":0.007973,"velocityX":0.280000,"velocityY":0.000005,"angularVelocity":0.478407,"longitudinalSpeed":0.280000,"lateralSpeed":-0.000034,"driftAmount":0.000000,"checkpoint":0,"lap":0,"racePosition":2,"finished":false},{"id":"ai-2","surface":"asphalt","x":27.005751,"y":17.099998,"rotation":0.001305,"velocityX":0.345000,"velocityY":0.000001,"angularVelocity":0.078274,"longitudinalSpeed":0.345000,"lateralSpeed":-0.000007,"driftAmount":0.000000,"checkpoint":0,"lap":0,"racePosition":5,"finished":false},{"id":"ai-3","surface":"asphalt","x":27.004667,"y":20.700001,"rotation":359.987854,"velocityX":0.280000,"velocityY":-0.000007,"angularVelocity":-0.728542,"longitudinalSpeed":0.280000,"lateralSpeed":0.000052,"driftAmount":0.000000,"checkpoint":0,"lap":0,"racePosition":4,"finished":false},{"id":"ai-4","surface":"asphalt","x":27.006834,"y":22.500000,"rotation":359.962921,"velocityX":0.410000,"velocityY":-0.000031,"angularVelocity":-2.225416,"longitudinalSpeed":0.410000,"lateralSpeed":0.000234,"driftAmount":0.000000,"checkpoint":0,"lap":0,"racePosition":3,"finished":false},{"id":"player","surface":"parquet","x":11.459447,"y":15.945679,"rotation":0.000000,"velocityX":3.424224,"velocityY":3.721963,"angularVelocity":0.000000,"longitudinalSpeed":3.424224,"lateralSpeed":3.721963,"driftAmount":0.000000,"checkpoint":0,"lap":0,"racePosition":6,"finished":false}],"ranking":["ai-0","ai-1","ai-4","ai-3","ai-2","player"],"finishedParticipants":[],"finishResults":[]}}]}
