{"schemaVersion":2,"scenarioId":"checkpoint-ordering-track-01","seed":9005,"samples":[{"label":"countdown","tick":0,"snapshot":{"schemaVersion":2,"simulationTick":0,"raceState":"countdown","countdown":{"state":"active","remainingSeconds":3.000000},"elapsedSimulationTime":0.000000,"currentLap":1,"currentProgress":{"checkpoint":0,"completedLaps":0},"participants":[{"id":"ai-0","surface":"asphalt","x":42.000000,"y":17.099998,"rotation":0.000000,"velocityX":0.000000,"velocityY":0.000000,"angularVelocity":0.000000,"longitudinalSpeed":0.000000,"lateralSpeed":0.000000,"driftAmount":0.000000,"checkpoint":0,"lap":0,"racePosition":2,"finished":false},{"id":"ai-1","surface":"asphalt","x":34.500000,"y":15.599999,"rotation":0.000000,"velocityX":0.000000,"velocityY":0.000000,"angularVelocity":0.000000,"longitudinalSpeed":0.000000,"lateralSpeed":0.000000,"driftAmount":0.000000,"checkpoint":0,"lap":0,"racePosition":3,"finished":false},{"id":"ai-2","surface":"asphalt","x":27.000000,"y":17.099998,"rotation":0.000000,"velocityX":0.000000,"velocityY":0.000000,"angularVelocity":0.000000,"longitudinalSpeed":0.000000,"lateralSpeed":0.000000,"driftAmount":0.000000,"checkpoint":0,"lap":0,"racePosition":6,"finished":false},{"id":"ai-3","surface":"asphalt","x":27.000000,"y":20.700001,"rotation":0.000000,"velocityX":0.000000,"velocityY":0.000000,"angularVelocity":0.000000,"longitudinalSpeed":0.000000,"lateralSpeed":0.000000,"driftAmount":0.000000,"checkpoint":0,"lap":0,"racePosition":5,"finished":false},{"id":"ai-4","surface":"asphalt","x":27.000000,"y":22.500000,"rotation":0.000000,"velocityX":0.000000,"velocityY":0.000000,"angularVelocity":0.000000,"longitudinalSpeed":0.000000,"lateralSpeed":0.000000,"driftAmount":0.000000,"checkpoint":0,"lap":0,"racePosition":4,"finished":false},{"id":"player","surface":"asphalt","x":90.000000,"y":35.900002,"rotation":90.000000,"velocityX":0.000000,"velocityY":24.000000,"angularVelocity":0.000000,"longitudinalSpeed":24.000000,"lateralSpeed":0.000000,"driftAmount":0.000000,"checkpoint":0,"lap":0,"racePosition":1,"finished":false}],"ranking":["player","ai-0","ai-1","ai-4","ai-3","ai-2"],"finishedParticipants":[],"finishResults":[]}},{"label":"racing","tick":0,"snapshot":{"schemaVersion":2,"simulationTick":0,"raceState":"racing","countdown":{"state":"complete","remainingSeconds":0.000000},"elapsedSimulationTime":0.000000,"currentLap":1,"currentProgress":{"checkpoint":0,"completedLaps":0},"participants":[{"id":"ai-0","surface":"asphalt","x":42.000000,"y":17.099998,"rotation":0.000000,"velocityX":0.000000,"velocityY":0.000000,"angularVelocity":0.000000,"longitudinalSpeed":0.000000,"lateralSpeed":0.000000,"driftAmount":0.000000,"checkpoint":0,"lap":0,"racePosition":2,"finished":false},{"id":"ai-1","surface":"asphalt","x":34.500000,"y":15.599999,"rotation":0.000000,"velocityX":0.000000,"velocityY":0.000000,"angularVelocity":0.000000,"longitudinalSpeed":0.000000,"lateralSpeed":0.000000,"driftAmount":0.000000,"checkpoint":0,"lap":0,"racePosition":3,"finished":false},{"id":"ai-2","surface":"asphalt","x":27.000000,"y":17.099998,"rotation":0.000000,"velocityX":0.000000,"velocityY":0.000000,"angularVelocity":0.000000,"longitudinalSpeed":0.000000,"lateralSpeed":0.000000,"driftAmount":0.000000,"checkpoint":0,"lap":0,"racePosition":6,"finished":false},{"id":"ai-3","surface":"asphalt","x":27.000000,"y":20.700001,"rotation":0.000000,"velocityX":0.000000,"velocityY":0.000000,"angularVelocity":0.000000,"longitudinalSpeed":0.000000,"lateralSpeed":0.000000,"driftAmount":0.000000,"checkpoint":0,"lap":0,"racePosition":5,"finished":false},{"id":"ai-4","surface":"asphalt","x":27.000000,"y":22.500000,"rotation":0.000000,"velocityX":0.000000,"velocityY":0.000000,"angularVelocity":0.000000,"longitudinalSpeed":0.000000,"lateralSpeed":0.000000,"driftAmount":0.000000,"checkpoint":0,"lap":0,"racePosition":4,"finished":false},{"id":"player","surface":"asphalt","x":90.000000,"y":35.900002,"rotation":90.000000,"velocityX":0.000000,"velocityY":24.000000,"angularVelocity":0.000000,"longitudinalSpeed":24.000000,"lateralSpeed":0.000000,"driftAmount":0.000000,"checkpoint":0,"lap":0,"racePosition":1,"finished":false}],"ranking":["player","ai-0","ai-1","ai-4","ai-3","ai-2"],"finishedParticipants":[],"finishResults":[]}},{"label":"simulation","tick":1,"snapshot":{"schemaVersion":2,"simulationTick":1,"raceState":"racing","countdown":{"state":"complete","remainingSeconds":0.000000},"elapsedSimulationTime":0.016667,"currentLap":1,"currentProgress":{"checkpoint":1,"completedLaps":0},"participants":[{"id":"ai-0","surface":"asphalt","x":42.006832,"y":17.099998,"rotation":359.999237,"velocityX":0.410000,"velocityY":-0.000001,"angularVelocity":-0.044940,"longitudinalSpeed":0.410000,"lateralSpeed":0.000005,"driftAmount":0.000000,"checkpoint":0,"lap":0,"racePosition":2,"finished":false},{"id":"ai-1","surface":"asphalt","x":34.505749,"y":15.599999,"rotation":0.011376,"velocityX":0.345000,"velocityY":0.000008,"angularVelocity":0.682539,"longitudinalSpeed":0.345000,"lateralSpeed":-0.000061,"driftAmount":0.000000,"checkpoint":0,"lap":0,"racePosition":3,"finished":false},{"id":"ai-2","surface":"asphalt","x":27.004667,"y":17.099998,"rotation":0.001257,"velocityX":0.280000,"velocityY":0.000001,"angularVelocity":0.075438,"longitudinalSpeed":0.280000,"lateralSpeed":-0.000005,"driftAmount":0.000000,"checkpoint":0,"lap":0,"racePosition":6,"finished":false},{"id":"ai-3","surface":"asphalt","x":27.005751,"y":20.700001,"rotation":359.989105,"velocityX":0.345000,"velocityY":-0.000008,"angularVelocity":-0.652849,"longitudinalSpeed":0.345000,"lateralSpeed":0.000058,"driftAmount":0.000000,"checkpoint":0,"lap":0,"racePosition":5,"finished":false},{"id":"ai-4","surface":"asphalt","x":27.006834,"y":22.500000,"rotation":359.962921,"velocityX":0.410000,"velocityY":-0.000031,"angularVelocity":-2.225416,"longitudinalSpeed":0.410000,"lateralSpeed":0.000234,"driftAmount":0.000000,"checkpoint":0,"lap":0,"racePosition":4,"finished":false},{"id":"player","surface":"asphalt","x":90.000000,"y":36.298889,"rotation":90.000000,"velocityX":0.000000,"velocityY":23.933332,"angularVelocity":0.000000,"longitudinalSpeed":23.933332,"lateralSpeed":0.000000,"driftAmount":0.000000,"checkpoint":1,"lap":0,"racePosition":1,"finished":false}],"ranking":["player","ai-0","ai-1","ai-4","ai-3","ai-2"],"finishedParticipants":[],"finishResults":[]}}]}
